<?xml version="1.0" encoding="UTF-8" ?>

<!DOCTYPE timetable SYSTEM 'timetable.dtd'>
<timetable>
    <year>2016</year>
    <term>Winter</term>
    <set>4S</set>
    <program>CST</program>
    <days>
        <day type="mon">
            <booking>
                <time>9:30-10:20</time>
                <room>SW5-1840</room>
                <instructor>
                    <name>Catherine Ryan</name>
                </instructor>
            </booking>
        </day>

        <day type="tues">
            <booking>
                <time>10:30-12:20</time>
                <room>SE12-308</room>
                <instructor>
                    <name>Medhat Elmasry</name>
                </instructor>
            </booking>
        </day>

        <day type="wed">
            <booking>
                <time>12:30-1:20</time>
                <room>SW3-1750</room>
                <instructor>
                    <name>Brenda Fine</name>
                </instructor>
            </booking>
        </day>

        <day type="mon">
            <booking>
                <time>12:30-11:20</time>
                <room>SE12-308</room>
                <instructor>
                    <name>Medhat Elmasry</name>
                </instructor>
            </booking>
        </day>
    </days>

    <period>
        <timeslot>
            <booking>
                <time>9:30-10:20</time>
                <room>SW5-1840</room>
                <instructor>
                    <name>Catherine Ryan</name>
                </instructor>
            </booking>
        </timeslot>
    </period>

    <period>
        <timeslot>
            <booking>
                <time>10:30-12:20</time>
                <room>SE12-308</room>
                <instructor>
                    <name>Medhat Elmasry</name>
                </instructor>
            </booking>
        </timeslot>
    </period>

    <period>
        <timeslot>
            <booking>
                <time>12:30-1:20</time>
                <room>SW3-1750</room>
                <instructor>
                    <name>Brenda Fine</name>
                </instructor>
            </booking>
        </timeslot>
    </period>

    <period>
        <timeslot>
            <booking>
                <time>10:30-11:20</time>
            <room>SE12-308</room>
            <instructor>
                <name>Medhat Elmasry</name>
            </instructor>
        </booking>
    </timeslot>
</period>

<courses>
<course>
    <booking>
        <time>8:30-10:20</time>
        <room>SW5-1840</room>
        <instructor>
            <name>Catherine Ryan</name>
        </instructor>
    </booking>
</course>
<course>
    <booking>
        <time>10:30-12:20</time>
        <room>SE12-308</room>
        <instructor>
            <name>Medhat Elmasry</name>
        </instructor>
    </booking>
</course>
<course>
    <booking>
        <time>12:30-1:20</time>
        <room>SW3-1750</room>
        <instructor>
            <name>Brenda Fine</name>
        </instructor>
    </booking>
</course>
<course>
    <booking>
        <time>12:30-11:20</time>
        <room>SE12-308</room>
        <instructor>
            <name>Medhat Elmasry</name>
        </instructor>
            </booking>
        </course>
    </courses>


</timetable>