<?xml version="1.0" encoding="UTF-8" ?>
        
<!DOCTYPE timetable SYSTEM 'timetable.dtd'>
<timetable>
    <year>2016</year>
    <term>Winter</term>
    <set>4S</set>
    <program>CST</program>
    <!-- days -->
    <days>
        <day type="Monday">
            <booking period="9:30-11:30" course="BLAW3600">
                <instructor>Catherine Ryan</instructor>
            </booking>
            <booking period="11:30-12:30" course="COMP4735">
                <instructor>Mirela Gutica</instructor>
            </booking>
            <booking period="12:30-14:30" course="COMP4735">
                <instructor>Mirela Gutica</instructor>
            </booking>
        </day>
    </days>

    <!-- periods -->
    <periods>
        <period type="11:30-12:30">
            <booking day="Monday" course="COMP4735">
                <instructor>Mirela Gutica</instructor>
            </booking>
            <booking day="Tuesday" course="COMP4560">
                <instructor>Brenda Fine</instructor>
            </booking>
            <booking day="Thursday" course="COMP4735">
                <instructor>Mirela Gutica</instructor>
            </booking>
        </period>
    </periods>
    <!-- courses-->
    <courses>
        <course type="BLAW3600">
            <booking day="Monday" period="8:30-9:30">
                <instructor>Catherine Ryan</instructor>
            </booking>
            <booking day="Friday" period="8:30-10:30">
                <instructor>Catherine Ryan</instructor>
            </booking>
        </course>
    </courses>
</timetable>